abv,barcode,beer,brewer,description,location,name,sku,style
4.50%,5060172030026,Oatmeal Stout,Founders Brewing Company ,"A Founders take on a classic style, brewed with a generous amount of flaked oats, chocolate malt, roasted barley and Nugget hops",Michigan,Coniston Oatmeal Stout,481688,Oatmeal Stout
6.00%,818534010132,Abraxxxas,Freigeist,"Light wheat, light smoke, hint of sourness",Germany,Freigeist Abraxxxas,478312,Smoked Lichtenhainer 
5.20%,818534012105,Geisterzug Gose,Freigeist,"""Ghost Train"" spruced Gose - complex and funky",Germany,Freigeist Geisterzug Gose,478314,Gose
5.50%,856520006097,Mango Hefeweizen,Garage Brewing Company,Vibrant mango flavors & lively carbonation reults in a tasty and refreshing brew,Temecula,Garage Mango Hefeweizen 22oz,771205,Hefeweizen
7.10%,,Marshmallow Milk Stout,Garage Brewing Company,"Notes of dark roasted malt, chocolate syrup, vanilla bean, and marshmallows!",Temecula,,,Milk Stout
8.00%,9421903026064,Pernicious Weed,Garage Project,a celebration of the NZ-developed hop varieties Nelson Sauvin and Rakau,New Zealand,Garage Project Pernicious Weed 22oz,2392263,IPA
7.30%,859416003002,Gigantic IPA,Gigantic Brewing Co.,"Floral, piney, citrusy",Oregon,Gigantic IPA,481591,IPA
7.30%,859416003002,Gigantic IPA,Gigantic Brewing Company,"Hopped with Cascade, Centennial, Crystal and Simcoe ","Portland, Oregon,",Gigantic IPA,481591,IPA
8.80%,859416003040,Ginormous,Gigantic Brewing Company,"Notes of pine, citrus hops, melon and grass","Portland, Oregon,",Gigantic Ginormous IPA,558539,Double IPA
6.00%,100000007761,Peace Loving Decoy,Gigantic Brewing Company,"Toasty Vienna malt aroma and citrusy, fruity and floral hops","Portland, Oregon,",Gigantic Peace Loving Decoy,561682,Vienna Lager 
8.00%,100000007136,Saboteur,Gigantic Brewing Company,"Flavors of chocolate, coffee, malt sweetness and hints of smoke","Portland, Oregon,",Gigantic Brewing Saboteur,561681,Baltic Porter
12.00%,029882559109,Savage Bois,Golden Coast Mead,"Dry, full-bodied, balanced, rich mead",Oceanside,Golden Coast Savage Bois 500ml,476842,Mead
12.00%,690926001221,Speakeasy,Golden Coast Mead,Mead with notes of oak and toasty caramel. Reminiscent of bourbon.,Oceanside,Speakeasy BA Scarface,835798,Mead
6.90%,856247005007,Mighty Dry,Golden State Cider,Crafted with a delicious blend of culinary apple varieties. No added water. No added sugar. No concentrates. No gluten. No bad juju.,"Sebastopol, CA",Golden State Mighty Dry Cider 16oz can,2658931,Cider
12.40%,,Barrel-Aged Hibernation (2014),Great Divide,"Over a year in whiskey barrels.  Big whiskey flavors mellow out into luscious chocolate, dark fruit, and vanilla.",Colorado,,,Old Ale
12.50%,,Barrel-Aged Yeti (2015),Great Divide,"Over a year in whiskey barrels.   The spirited aging process produces a hugely complex but mellowed Yeti, with its signature roasted flavors, hints of vanilla and oak, and a whiskeyed finish.",Colorado,,,Imperial Stout
9.50%,790586000258,Chocolate Oak Aged Yeti ,Great Divide,Notes of espresso and dark chocolate ,Colorado,Great Divide Chocolate Oak Aged Yeti 22oz,477443,Imperial Stout
9.50%,,Chocolate Oak-Aged Yeti,Great Divide,"Cocoa nibs contribute some pleasing bitterness, while vanilla notes from the oak combine with the cocoa to create an aroma and flavor akin to a gourmet chocolate bar. A dash of cayenne keeps things lively, adding just a bit of heat to the finish",Colorado,,,Imperial Stout
7.70%,790586012244,Claymore,Great Divide,"Malty, with generous amount of caramel sweetness",Colorado,Great Divide Claymore,477455,Scotch Ale
7.30%,790586012275,Colette,Great Divide,"Brewed with barley, wheat and rice and fermented at high temperatures with a special blend of four different yeast strains it is fruity and slightly tart, with a dry finish",Colorado,Great Divide Colette 12oz,477456,Saison
6.20%,790586090129,Hoss,Great Divide,"Rich, layered malt notes, with hints of cherry and dark fruits, dominate, while the unique addition of rye imparts a slightly earthy, spicy character. Hoss finishes crisp and dry.",Colorado,Great Divide Hibernation/Hoss CAN,,Oktoberfest/Märzen
6.30%,790586012176,Nadia Kali,Great Divide,"A generous infusion of hibiscus and ginger root gives it a subtle spice and hint of woodsy maturity, and lemon peel adds a citrus tartness to keep you on your toes",Colorado,Great Divide Nadia Kali 12oz,,Saison
8.30%,100000010433,Orabelle,Great Divide,Belgian style Tripel with orange peel and corriander,Colorado,Great Divide Orabelle,835110,Tripel
12.00%,790586000456,Peach Grand Cru,Great Divide,"Notes of caramel, stone fruit, and syrup",Colorado,Great Divide Peach Grand Cru,477450,Belgian Strong Dark Ale
7.10%,790586012145,Titan,Great Divide,"Piney up front, with a nice citrus flavor, and a good malt backbone",Colorado,Great Divide Titan,477453,IPA
7.30%,790586012275,Colette,Great Divide Brewing Co.,"Fruity and slightly tart, with a dry finish ",Colorado,Great Divide Colette 12oz,477456,Saison
6.20%,,21st Anniversary Sour,Great Divide Brewing Company,"Bright, tart, kiwi & citrus notes; hint of oak & subtle white wine-like character",Colorado,,,Wild Ale
4.50%,,Short Stack,Green Flash,"Brewed with buckwheat, oats, maple-smoked malt to emulate pancakes and cold brewed coffee to round out the breakfast experience. ","San Diego, CA",,,American Stout
10.10%,830746001425,Silva Stout,Green Flash,"A viscous bourbon barrel-aged stout wuith notes of sweet bourbon, coffee, and chocolate","San Diego, CA",Green Flash Silva Stout,481250,Barrel-Aged Imperial Stout
5.90%,,12th Anniversary Ale,Green Flash Brewing Co.,Dry-hopped American Sour Pale,San Diego,,,Sour
4.50%,,Hop Odyssey Mosaic,Green Flash Brewing Co.,"100% Mosaic hops, earthy notes, tropical fruit and dark berries",San Diego,,,Session IPA
7.70%,,Jolly Folly,Green Flash Brewing Co.,Resinous and piney aromas with layers of citrus and tropical hop flavors,San Diego,,,IPA
5.70%,830746000466,Treasure Chest,Green Flash Brewing Co.,"Brewed w/ grapefruit, prickly pear juice & hibiscus flowers & 100% Mosaic hops ",San Diego,Green Flash Treasure Chest 22 oz,1354893,IPA 
5.00%,784672274937,Rainbow Dome,Grimm Artisanal Ales,"Dry Hopped, Oaked Wild / Sour brewed with Apricots",New York,Grimm Rainbow Dome,1467264,Oaked Wild
5.00%,646437576734,Subliminal Message,Grimm Artisanal Ales,Sour red ale brewed with tart cherries,New York,Grimm Subliminal Message,2218741,Sour
4.80%,784672274944,Super Symmetry,Grimm Artisanal Ales,"Dry Hopped, Oaked Gose with Lemon Zest",New York,Grimm Super Symmetry Bottle,1467267,Gose
5.20%,784672274869,Telekinesis,Grimm Artisanal Ales,"Hoppy & tart. Mosaic, Citra, & Falconer’s Flight lend a tropical hop character",New York,Grimm Telekinesis 22oz,,Sour Farmhouse
5.20%,,Piloncillo Brown,Groundswell,"Brewed w/ Mexican Piloncillo Sugar, malt forward w/ strong notes of Caramel, Brown Sugar, Molasses, Chocolate & Toffee",San Diego,,,American Brown Ale
5.40%,,Tropical Hefe,Groundswell,"This hybrid Hefe is dry hopped with New Zealand and Australian hops, but only to impart aroma and flavor with out bitterness. The use of those hops give this Hefe notes of pineapple, mango, passion fruit, peach and apricot","San Diego, CA",,,American Pale Wheat
6.40%,,Oude Gueuze Tilquin à L'Ancienne,Gueuzerie Tilquin,"Spontaneous fermentation beer, produced from the blending of 1, 2 and 3 year old lambics",Belgium,,,Gueuze
8.00%,608782669387,Haandbakk,Haandbryggeriet,"Aromas of sour berries, wood, and dried fruit",Norway,Haandbryggeriet Haandbakk,478647,Sour Red
5.80%,,Hacker-Pschorr Oktoberfest,Hacker-Pschorr Bräu,Aromas of sweet bread and toasted malt,Germany,,,Märzen
8.00%,696859190476,Rose,Hair of the Dog,"Named for Portland, the rose city, this Belgian Tripel is made with beets, hibiscus flowers and pink peppercorns.",Oregon,Beachwood Melrose 22oz,476123,Tripel
5.20%,,Daisy Cutter,Half Acre,A west coast pale ale full of dank aromatic hops,"Chicago, IL",,,Pale Ale
8.70%,,#Buzzwords,Half Door Brewing,"A super dank pale ale with Simcoe, Citra, Galaxy, Amarillo, Chinook, & Mosaic.  This shit is so lit it will leave you in the burn ward.","San Diego, CA",,,Double IPA
6.50%,,Hoban House,Half Door Brewing,"North East style IPA brewed with Citra, Amarillo, Galaxy, & Mosaic.  Intentionally unfiltered.  Juicy, hazy, and turbid AF.","San Diego, CA",,,IPA
7.20%,,House of Hops,Half Door Brewing,"Piney, resinous, and citrusy hops","San Diego, CA",,,IPA
7.20%,,Northeast IPA,Half Door Brewing,"Intentionally unfiltered, this big juicy IPA packs a fruity punch beneath the haze.","San Diego, CA",,,IPA
5.20%,,Roark Red,Half Door Brewing,Roasty and nutty with mild hop backbone,San Diego,,,Irish Red
13.80%,100000126622,Pugachev's Cobra (2016),Hangar 24,"This rich, black beauty with a thick caramel head is bursting with aromas of chocolate, vanilla, oak, bourbon, licorice and dark fruits, while flavors of chocolate-covered plum, sweet malt, bourbon, and roasted coffee explode on your palate","Redlands, CA",Hangar 24 Pugachev's Cobra 2016,476380,Barrel-Aged Imperial Stout
18.90%,,Pugachev’s Cobra (2014),Hangar 24,"Aromas of chocolate, vanilla, oak, bourbon, licorice and dark fruits","Redlands, CA",,,BA Imperial Stout
7.80%,,Winter Warmer,Hangar 24,"Brewed with spruce tips, maple syrup and cinnamon.","Redlands, CA",,,Spiced Ale
6.00%,,Oudbeitje Lambic,Hanssens Artisanaal,"Slightly carbonated; strawberries on aroma and palate, tart and dry-",Belgium,,,Strawberry Lambic
5.10%,,Westcoaster,Home Brewing Company,"Hopped w/ fresh Chinook, Cascade, Columbus. Collaboration w/ Westcoaster Magazine.",San Diego,,,Fresh Hop Red Ale
11.00%,,Straffe Hendrik Heritage Quadrupel,Huisbrouwerij De Halve Maan,"Rich and intense dark Belgian ale, dark in color, chewy, malty and complex",Belgium,,,Oak Aged Quadrupel
5.50%,,Killarney's 10th Irish Red,Ironfire Brewing Company,Caramel malt flavor & sweetness with hints of toffee,Temecula,,,Irish Red
6.50%,100000011393,Hamajang,Jolly Pumpkin / Mikkeller / Evil Twin / Leelanau,Blend of two oak-aged sours with sea buckthorn and strawberries,Michigan,Jolly Pumpkin / Mikkeller / Evil Twin Hamajang 750ml,2320738,Sour
4.50%,,Bam Bière,Jolly Pumpkin Artisan Ales,"Slightly sour grain, earth, funk, and yeast flavors on the finish",Michegan,,,Farmhouse Saison
4.30%,897435000312,Bam Noire,Jolly Pumpkin Artisan Ales,"Aromas of worn leather, flavors of sweet plum & toasted raisin, coffee & cacao",Michigan,Jolly Pumpkin Bam Noire,478141,Dark Farmhouse Ale
6.80%,,Baudelaire Beer iO Saison,Jolly Pumpkin Artisan Ales,"Brewed w/ rose hips, rose petals & hibiscus. Aroma is floral, wild, funky",Michegan,,,Tart Saison
4.80%,897435000039,Calabaza Blanca,Jolly Pumpkin Artisan Ales,"Spiced with orange peel and coriander; tart, with a wonderful dry finish",Michegan,Jolly Pumpkin Calabaza Blanca,478135,Sour Witbier
6.10%,,Fuego del Otoño,Jolly Pumpkin Artisan Ales,Tart amber Saison brewed with chestnut and spices,Michegan,,,Sour Amber Saison
5.90%,897435004426,La Parcela,Jolly Pumpkin Artisan Ales,Tart earthiness with a hint of pumpkin spice and a little cocoa in the dry finish,Michigan,Jolly Pumpkin La Parcela 750ml,478146,Sour Pumpkin 
7.50%,857193003246,La Roja du Kriek,Jolly Pumpkin Artisan Ales,"3,100 gallons of 2013 La Roja meets 50 gallons of Michigan tart cherry juice",Michegan,Jolly Pumpkin La Roja du Kriek 750ml,2320740,Sour red with Cherries
7.40%,,La Rojzilla,Jolly Pumpkin Artisan Ales,Foudre aged La Roja; aged for a year and a half,Michegan,,,Sour Red
8.10%,,Madrugada Obscura,Jolly Pumpkin Artisan Ales,Belgian style stout aged in oak and bottle conditioned,Michigan,,,Sour Stout
5.00%,,Wet-Hopped Saison,Jolly Pumpkin Artisan Ales,"Light, crisp and bright with a bit of funk and slight tartness. Nice hoppy notes. ",Michigan,,,Saison
6.99%,858969003019,Cherry Bomb,Julian Hard Cider,"Clean, crisp, hard apple cider infused with juice from the Montmorency Cherry",Julian,Julian Cherry Bomb,476565,Cider
8.90%,,Peanut Butter Cup Porter (2015 Barrel-Aged),Karl Strauss,"Brewed annually for SDBW, this version of the chocolate and peanut butter porter was aged in Elijah Craig Barrels. ","San Diego, CA",,,Bourbon Barrel-Aged Porter 
5.60%,796535001369,Peanut Butter Cup Porter,Karl Strauss Brewing Company,Rich layers of smooth peanut butter and dark chocolate flavors,San Diego,Karl Strauss Peanut Butter Cup Porter,481184,Porter
8.00%,,Singularity,Karl Strauss Brewing Company,Silver Medal 2015 GABF in American-style Black Ale,Costa Mesa,,,Black IPA
8.00%,868995000036,Citra,Kern River Brewing,Hazy pale in color with a strong pungent aroma that comes from large amounts of Citra hops,"Kernville, CA",Against the Grain Citra Ass Down 16oz can,1548523,Double IPA
8.50%,895801001246,Class V,Kern River Brewing,Rich notes of sweet cocoa and coffee.,Kernville,Kern River Class V Stout 22oz,476364,Imperial Stout
8.00%,895801001291,Dirty Hippie,Kern River Brewing,Dry-hopped with Summit and Simcoe.  A whole lot of hoppy goodness balanced with a nice malt backbone ,"Kernville, CA",Kern River Dirty Hippie 22oz,1134460,Imperial Red Ale
5.00%,895801001314,Gravity Check,Kern River Brewing,This beer blends the lightness of pilsner malts with enough Mosaic hops to satisfy even the biggest hop head,"Kernville, CA",Kern River Gravity Check 22oz,743687,Session IPA
5.00%,895801001314,Gravity Check,Kern River Brewing,"Aroma is floral, citrus and tropical hops with light biscuit malt",Kernville,Kern River Gravity Check 22oz,743687,Session IPA
11.00%,895801001321,Hop Nookie,Kern River Brewing,"Loaded with Chinook and Amarillo hops and brewed with California Ale yeast, specialty malts and Sierra Mountain water. ","Kernville, CA",Kern River Hop Nookie 22oz,,Triple IPA
6.80%,895801001239,Just Outstanding,Kern River Brewing,Dry hopped with Simcoe and Amarillo to give it that great floral aroma and citrus finish,"Kernville, CA",Kern River Just Outstanding 22oz,476363,IPA
5.60%,895801001338,River Buddy,Kern River Brewing,"Citra, simcoe, and eureka hops combined with clean crisp sierra mountain water will make this hoppy ale your best friend","Kernville, CA",Kern River River Buddy 22oz,100000124635,Pale Ale
5.20%,895801001222,Sequoia Red,Kern River Brewing,"A classic American Amber Ale, this beer balances a variety of malts with a blend of German hops. With its distinctive copper color and caramel flavors, this beer is unforgettable and ""Giantly Delicious""","Kernville, CA",Kern River Sequoia Red 22oz,2803951,American Amber Ale
7.00%,,Think Tank #11,Kern River Brewing,A series of experimental beers from Kern River featuring different hop varietals ,"Kernville, CA",,,IPA
7.00%,,Saison Acidifié,Kinetic Brewing Company,Sour Saison!,"Lancaster, California",,,Tart Saison
5.50%,,Hitachino Nest White Ale,Kiuchi Brewery ,"Brewed in the Belgian tradition w/ coriander, nutmeg, orange peel & orange juice",Japan,,,Witbier
8.70%,,6th Anniversary DIPA,Knee Deep,Sweet and citrus upfront leading to a hoppy resinous slightly malty sweet but bitter finish,"Auburn, CA",,,Double IPA
4.50%,,6th Anniversary Session,Knee Deep,"6 hops: Amarillo, Cascade, Centennial, Chinook, Citra, CTZ.  Flavors of grapefruit and lime with a light finish.","Auburn, CA",,,Session IPA
8.00%,736211628367,Big Sipper,Knee Deep,"A golden citrusy, floral, slightly fruity DIPA, with a crisp dry finish. Dry Hopped with Citra, Centennial, and Simcoe","Auburn, CA",Knee Deep Big Sipper 22oz,2316402,Double IPA
8.00%,736211628664,Lupulin River,Knee Deep,"Tropical and Piney, hopped with simcoe and mosaic","Auburn, CA",Knee Deep Lupulin River 22oz,847519,DIPA
5.50%,,Tater Hops,Knee Deep,"Simple malt bill to showcase the hop flavors and aroma, Orange/citrus, dark fruit, herbal aromas and flavors. Crisp dry finish.","Auburn, CA",,,Pale Ale
11.25%,736211629265,Simtra,Knee Deep Brewing Co.,"Earthy hoppiness, citrus, tropical fruit, sugar, and alcohol","Auburn, CA",Knee Deep Simtra,476210,Tripel IPA
6.50%,653341883391,Breaking Bud,Knee Deep Brewing Company,Classic IPA with newer tropical fruit hop flavors and aromas of Mosaic,"Auburn, CA",Knee Deep Breaking Bud 16oz CAN,100000101070,IPA
8.00%,736211628664,Lupulin River,Knee Deep Brewing Company,"Notes of tropical fruits, pineapples, mangoes, oranges, lemon zest","Auburn, CA",Knee Deep Lupulin River 22oz,847519,Double IPA
6.40%,,Deep Dish,Knee Deep/Pizza Port,"Grist being 20% wheat gives the beer a pale yellow color and a clean/crisp finish, yet medium bodied mouthfeel.  Citra, Mosaic and Galaxy hops.","Auburn, CA",,,IPA
4.80%,4014964007773,Schwarzbier ,Köstritzer,"Malty, Roasty, Sweet, Earthy, Light-bodied",Germany,Köstritzer Schwarzbier 500ml can 4pk,478322,Schwarzbier (Black Lager)
7.60%,,Project Dank,La Cumbre,"Project Dank is just that; a project. It’s an ever changing expression of our hoppiest endeavors. Each recipe is different, featuring different hops and hopping techniques. One thing will remain common…HOP INSANITY.",New Mexico,,,IPA
6.50%,723830000056,Born Yesterday,Lagunitas,The hops go into a proprietary Borning Process which allows them to take these whole-cone hops (not pellets or oils or other sorcery) and deliver their absolute essence and liquid likeness,"Petaluma, CA",Lagunitas Born Yesterday 12oz,476171,Pale Ale
11.50%,,The Waldos' 420 Special,Lagunitas,The dankest and hoppiest beer ever brewed at Lagunitas,"Petaluma, CA",,,Triple IPA
11.70%,,Willet Imperial Stout,Lagunitas,"A blended beer using Willett Family Reserve Bourbon barrels aging their Imperial Stout for 3 months, 6 months and 9 months then blended","Petaluma, CA",,,Barrel-Aged Stout
7.50%,,A Little Sumpin’ Sumpin’,Lagunitas Brewing Company,Citrusy wheat pale ale,Petaluma,,,American Pale Wheat
7.50%,723830000056,Born Yesterday,Lagunitas Brewing Company,"Fresh hop Simcoe, Mosaic pale ale",Petaluma,Lagunitas Born Yesterday 12oz,476171,Pale Ale
11.10%,,Waldo's Special Ale,Lagunitas Brewing Company,4/20 Special Double IPA,Petaluma,,,Tripel IPA
5.50%,738435171254,Kili Wit,Logsdon Farmhouse Ales,Traditionally brewed white beer with refreshing flavors & creamy smoothness,Oregon,Logsdon Kili Wit 375ml,481536,Witbier 
8.00%,,Oak-Aged Seizoen Bretta,Logsdon Farmhouse Ales,"Funky, dry with oak tannins, vanilla notes and subtle smoky spiciness",Oregon,,,Oak-Aged Saison
8.00%,738435171186,Seizoen Bretta,Logsdon Farmhouse Ales,"One of our favorite saisons. Funky, dry and crisp.",Oregon,Logsdon Seizoen Bretta 375ml,481535,Saison
7.80%,804551346101,The Conversion,Logsdon Farmhouse Ales,"Tart, juicy ale brewed in the farmhouse tradition & opened to wild fermentation",Oregon,Logsdon The Conversion 750ml,2354666,Wild Ale
7.10%,100000011911,Avant Gourde,Lost Abbey,,San Marcos,KEG - Lost Abbey Avant Gourde,481446,Pumpkin Biere de Garde
11.00%,689926005278,Cuvee de Tomme,Lost Abbey,"Sour with hints of dates, raisins, cherry, oak and vanilla",San Marcos,Lost Abbey Cuvee de Tomme,481166,Sour
13.70%,689926060840,Track 8,Lost Abbey,Brewed with cinnamon sticks and dried chili peppers,San Marcos,Lost Abbey Track 8,481172,Barrel-Aged Strong Ale
12.50%,689926005292,Deliverance,Lost Abbey Brewing Company,Blend of bourbon BA Serpent’s Stout & brandy BA Angels Share,San Marcos,Lost Abbey Deliverance 375ml,481474,American Strong Ale
4.10%,,Salty Kiss,Magic Rock Brewing,"Gose, flavored with Gooseberries, Sea Buckthorn and Sea Salt",England,,,Gose
5.20%,608782666805,Ungespundet,MAHR'S BRÄU,"The hazy, unfiltered lager of your dreams, with unbelievable body, freshness, and flavor. ",Germany,Mahrs Ungespundet Lager,478279,Kellerbier
5.20%,,Kellerbier Ungespundet,Mahrs Bräu,Unfiltered lager. Notes of honey and biscuits.,Germany,,,Zwickle
6.00%,730957374434,Mo,Maine Beer Co,"Flavors and aromas of zesty citrus, passionfruit, and pine present themselves throughout. A very subtle malt sweetness for balance",Maine,18th Street Moonwalk,892558,Pale Ale
5.50%,,Peeper,Maine Beer Co,"Dry, clean and well balanced with a generous dose of American hops. ",Maine,,,Pale Ale
7.00%,8717624428135,Lunch,Maine Beer Co.,"Intense hop flavors and tropical, citrus fruit and pine aromas dominate the flavor profile, balanced by subtle malt sweetness",Maine,Evil Twin Naked Lunch,478897,IPA
5.50%,180716000690,Double Nut Brown,Mammoth Brewing,Mild sweetness upfront finishing with a roasty dryness,Mammoth Lakes,Mammoth Double Nut Brown 22oz,476066,Porter
8.00%,180716000171,IPA 395,Mammoth Brewing,Brewed with Sage and Juniper Berries,Mammoth Lakes,Mammoth IPA 395 12oz,476062,IPA
9.00%,,Double Overhead,Maui Brewing Company,"Layered with hops from beginning to end. Its rich, silky sweet body gives a hefty backbone for the hop additions. The hop profile offers hints of tropical fruit and citrus which balance well with the silky malt flavors. ""Big braddah to the Big Swell IPA""",Hawaii,,,Double IPA
9.40%,858799002268,Imperial Coconut Porter,Maui Brewing Company,"Brewed with nearly double the amount of coconut, the flavor also consists of rich chocolate, roast malts, and layers of cocoa and mocha",Hawaii,Maui Imperial Coconut Porter,100000124277,Imperial Porter
5.10%,,Kihei Kolsch,Maui Brewing Company,"Light, crisp and flavorful. Blend of German noble hops and spicy, citrusy hops from the Pacific Northwest",Hawaii,,,Kölsch 
6.80%,,Shifting Winds,Maui Brewing Company,An IPA base finished with a Belgian yeast strain for the best of both worlds,Hawaii,,,Belgian IPA
13.00%,,Termination Dust ,Midnight Sun Brewing,Belgian Barleywine aged in High West bourbon oak barrels,Alaska,,,NITRO BBA Barleywine
7.80%,,T.R.E.A.T.,Midnight Sun Brewing,Imperial Chocolate Pumpkin Porter,Alaska,,,Imperial Pumpkin Porter
7.00%,707408002239,Trickster,Midnight Sun Brewing,"Light notes of pumpkin spice along with yeast, banana, nutmeg and cloves",Alaska,Midnight Sun Trickster bottle,477894,Belgian-style Pumpkin Ale 
7.50%,,Beer Geek Bacon,Mikkeller,A smoked version of Beer Geek Breakfast,Denmark,,,Smoked Oatmeal Stout
10.90%,,Beer Geek Brunch Weasel,Mikkeller,"Brewed w/ one of the most expensive coffees, made from droppings of civetcats",Denmark,,,Coffee Oatmeal Stout
7.50%,,Beer Geek Flat White,Mikkeller,Oatmeal Stout brewed with coffee and lactose.,Denmark,,,Sweet Stout
8.00%,,From / To / Via,Mikkeller,Holiday Porter brewed with spices,Denmark,,,Baltic Porter
5.00%,,Raspberries & Cream,Mikkeller,Oaked Raspberry Cream Ale,Denmark / San Francisco,,,Cream Ale
7.50%,818534012518,Rauch Geek Breakfast,Mikkeller,A smoked version of Beer Geek Breakfast Stout,Torrance,Mikkeller Rauch Geek Breakfast,478760,Smoked Oatmeal Stout
8.90%,,Single Hop Citra,Mikkeller,,Denmark,,,Imperial IPA
8.90%,,Single Hop Simcoe,Mikkeller,,Denmark,,,Imperial IPA
7.70%,818534015717,Spontanhibiscus,Mikkeller,Aromas of bread and sour fruits with floral notes.,Denmark,Mikkeller Spontanhibiscus,558511,Sour
12.00%,,Beer Geek Speedway,Mikkeller / AleSmith,Imperial Oatmeal Stout with Kopi Luwak Coffee,San Diego,,,Imperial Stout
12.00%,,Beer Geek Daydream,Mikkeller / Siren,"White stout brewed with coffee, cocoa and vanilla.",England,,,White Stout
5.50%,8185340126790,BetelGeuze,Mikkeller / To Øl ,Hoppy and sour. Collaboration between Mikkeller and To Øl ,Denmark,Mikkeller/To Ol BetelGeuze Bottle,705837,Gueuze
7.70%,818534012945,Blå Spøgelse,Mikkeller + Three Floyds,"Sour Ale with Blueberries, aged in Oak Barrels",Denmark,Mikkeller Blå Spøgelse Bottle,1358453,Blueberry Lambic
7.90%,100000012222,Juicebag,Mikkeller + To ØL Collaboration,An Oud Bruin Ale brewed with more citrus fruits than your local market,Denmark,KEG Mikkeller Juicebag 20L,835267,Oud Bruin
10.00%,,Belgian Dark Strong,Mikkeller SD,a heavy dark Belgian ale inspired by the Trappist monasteries,San Diego,,,Belgian Stong Dark Ale
8.00%,728795049881,Cherrykriek,Millstone Cellars,Polish Sour Cherries and Dark cherries blended with oak-aged cider,Maryland,Millstone Cherrykriek Cider,1674506,Cider
8.00%,728795049881,Cherrykriek,Millstone Cellars,Polish Sour Cherries and Dark cherries blended with oak-aged cider,Maryland,Millstone Cherrykriek Cider,1674506,Cider
7.00%,866666000132,Diehard,Mission-Trail Cider Company,"Made from Winesap, Spitzenburg, and Newtown Pippin apple varieties. A hint of apple sweetness with the full flavor and tartness of these varieties.","Bradley, CA",Mission Trails Diehard Cider,2403821,Cider
6.20%,,Accumulated Knowledge,Modern Times,"Bursting with stone fruit, citrus, and pine, this beer dazzles the palate before exiting with a beautifully dry finish","San Diego, CA",,,IPA
4.80%,,Apricot Fruitlands,Modern Times,"The sour, salty base beer brings funky refreshment and a heavy dose of apricots makes it a stone fruit bomb",San Diego,,,Gose
7.10%,,Asteroid Cowboy,Modern Times,Dry-hopped kettle sour aged in red wine barrels,"San Diego, CA",,,Sour Ale
6.70%,796535000829,Aurora,Modern Times,Spicy malt character of rye with fruity dankness of new wave American hops,San Diego,Karl Strauss Aurora Hoppyalis 12oz,2151457,Red Rye IPA
11.00%,,BA Devil's Teeth ,Modern Times,"An Imperial Stout Old Ale hybrid aged in bourbon barrels brings a rich maltiness and roastiness in a tongue coating, aggressively flavorful package","San Diego, CA",,,Hybrid Stout
11.00%,,"BA Devil's Teeth w/ Almond, Vanilla & Cocoa",Modern Times,Aged in bourbon barrels resulting in a beautiful melange of dessert-like flavors that leave the palate stunned in ecstasy,"San Diego, CA",,,Hybrid Stout
11.00%,,BA Devil's Teeth w/ Barrel-Aged Coffee,Modern Times,The blood orange and hibiscus Fruitlands version also has Vanilla beans added to simulate a creamsicle,"San Diego, CA",,,Hybrid Stout
11.00%,,"BA Devil's Teeth w/ Orange Zest, Hazelnut, and Cocoa",Modern Times,Aged in bourbon barrels yielding a tapestry of flavors and aromas that light up your olfactory pleasure centers,"San Diego, CA",,,Hybrid Stout
13.70%,,BA Monster's Park w/ Vanilla,Modern Times,The blood orange and hibiscus Fruitlands version also has Vanilla beans added to simulate a creamsicle,"San Diego, CA",,,Barrel-Aged Imperial Stout
