abv,barcode,beer,brewer,description,location,name,sku,style
5.80%,,Black House with Coconut & Cacao Nibs,Modern Times,"Stout with coffee, toasted coconut and cocoa nibs added",San Diego,,,American Stout
7.00%,,Blam! Blam!,Modern Times,"Absurd amounts of uber-fresh Nelson, Denali, and Amarillo hops turn this beverage into a face-full of piney dankness over a bed of lush, tropical delights.","San Diego, CA",,,IPA
6.80%,850352005150,Blazing World,Modern Times,Hoppy Amber ,San Diego,Modern Times Blazing World,481271,IPA
4.80%,,Blood Orange and Hibiscus Fruitlands,Modern Times,"Sour, Salty base brings funky refreshment with a dose of blood oranges and hibiscus for a fruity treat","San Diego, CA",,,Gose
6.80%,100000097250,Booming Rollers,Modern Times,IPA brewed with Citra hops as well as Motueka and Centennial,San Diego,Modern Times Booming Rollers Can,588516,IPA
6.80%,100000097250,Booming Rollers,Modern Times,"IPA hopped with Citra, Motueka, and Centennial",San Diego,Modern Times Booming Rollers Can,588516,IPA
13.70%,,Bourbon Barrel-Aged Monster's Park,Modern Times,"Hulking, cantankerous stout, aged in fragrant, oaky bourbon barrels. The barrel character is immediately evident on the nose and grows more intense in the flavor. Notes of vanilla, caramel, and molasses.","San Diego, CA",,,Barrel-Aged Imperial Stout
13.70%,,Bourbon Barrel-Aged Monster's Park,Modern Times,"Hulking, cantankerous stout, aged in fragrant, oaky bourbon barrels. The barrel character is immediately evident on the nose and grows more intense in the flavor. Notes of vanilla, caramel, and molasses.",San Diego,,,Barrel-Aged Imperial Stout
6.60%,,Centaur Gardens,Modern Times,"Chock-full of Southern Passion, Simcoe, and Citra hops for a profile bursting with lush, tropical flavors, notes of citrus, and a rich, juicy mouthfeel","San Diego, CA",,,IPA
7.60%,850352005204,City of the Sun,Modern Times,"Big, fruity, pungent, sticky, delicious IPA",San Diego,Modern Times City of the Sun/Aurora CAN,477504,IPA
13.70%,,Coconut Cocoa Bourbon Monster's Park,Modern Times,"Coconut and chocolate team up with decadent notes of bourbon and roasty malt radness, adding layers of delicious complexity that explode across the palate, continuing to evolve through a long, beautiful finish.",San Diego,,,Barrel-Aged Imperial Stout
13.70%,,Coffee Bourbon Monster's Park,Modern Times,"Big, thunderous notes of coffee, oak, & bourbon add a crazy dimension to this sledgehammer of sabor, combining with the massive roastiness of Monsters' Park to create a wildly complex and delicious beer.",San Diego,,,Barrel-Aged Imperial Stout
8.00%,,Divine Smite,Modern Times,"Packed to bursting with a glorious amalgam of Calypso, El Dorado, Horizon, Nugget, and J-17 hops","San Diego, CA",,,Double IPA
5.30%,,Fiesta Carnival,Modern Times,Northeast-style hazy pale ale brewed with Galaxy hops.,"San Diego, CA",,,Pale Ale
7.50%,,Floating World IPA,Modern Times,Brewed with two hard to get South African Hops: J-17 and Southern Passion,San Diego,,,IPA
7.50%,,Floating World IPA,Modern Times,Brewed with two hard to get South African Hops: J-17 and Southern Passion,San Diego,,,IPA
5.00%,850352005105,Fortunate Islands,Modern Times,"Easy drinking wheat beer with aromatics of mango, tangerine, and passionfruit",San Diego,Modern Times Fortunate Islands,477503,American Pale Wheat
5.00%,,Fortunate Islands with Grapefruit,Modern Times,"The hoppy, tropical aroma & flavor of Fortunate Islands is the perfect canvas for grapefruit zest, made by hand-peeling a zillion goddamn grapefruits and adding only the oily skin to the beer",San Diego,,,Hoppy Wheat
4.90%,850352005372,Fruitlands,Modern Times,"Notes of bright sour cherries, heavy lacto, a bit of herbal tanginess and salt",San Diego,Modern Times Fruitlands 22oz,1241345,Gose with Sour Cherries 
4.80%,,Fruitlands with Passion Fruit and Guava,Modern Times,"Tart, refreshing, complex yet shockingly drinkable, with just enough funk",San Diego,,,Gose
7.50%,,Golden Pineapple,Modern Times,"The meticulously blended progeny of City of the Sun IPA & Neverwhere 100% Brett IPA. The resulting beer is complex, intensely tropical, and outrageously bomb","San Diego, CA",,,Brett IPA
10.00%,100000013922,Hooloomooloo,Modern Times,"Massive tropical fruit aroma & flavor, firmly bitter but alarmingly drinkable",San Diego,Modern Times Hooloomooloo 22oz,2061170,Double IPA
4.70%,852892003221,Ice,Modern Times,"Maximum crushability, hopped with Czech Saaz and Austrailian Summer Hops",San Diego,2 Towns Nice & Naughty/Serious Scrump,836023,Pilsner
6.20%,,Iron Sunrise,Modern Times,Robust hoppiness of an IPA with the easy drinking qualities of a pils.  Utilizes hops sourced from New Zealand and Yakima,San Diego,,,India Pale Lager
5.50%,100000013908,Lomaland,Modern Times,"Earthy, rustic Belgian-style farmhouse ale",San Diego,Modern Times Funky Lomaland,2064803,Saison
8.50%,100000013939,Lost Horizon,Modern Times,"Double IPA featuring Centennial, Chinook, Simcoe, and Calypso hops",San Diego,Modern Times Lost Horizon,1410979,Double IPA
7.50%,,Mage Hand,Modern Times,Doubled dry hopped with Chinook and Equinox hop oil. Dank and lemony,San Diego,,,IPA
10.00%,,Mega Black House,Modern Times,"Thick, chewy, and bursting with coffee aroma & flavor","San Diego, CA",,,Imperial Stout
10.00%,,Mega Black House,Modern Times,"Thick, chewy, and bursting with coffee aroma & flavor",San Diego,,,Oatmeal Coffee Stout
10.00%,,Mega Black House w/ Double Coffee,Modern Times,Brewed with Single origin Kenya Coffee. A complex sipper that showcases the brilliant interaction of dark roasted malt and coffee.,"San Diego, CA",,,Imperial Stout
10.00%,,Mega Black House w/ NOLA Style Coffee,Modern Times,"Brewed with coffee, almonds, and chicory. Thick, chewy, and bursting with coffee aroma & flavor.","San Diego, CA",,,Imperial Stout
10.00%,,Mega Black House w/ Peanut Butter and Cocoa Nibs,Modern Times,"Brewed with Peanut Butter and Cocoa nibs.  Rich, dark, and complex.","San Diego, CA",,,Imperial Stout
8.50%,,Mega Blazing World,Modern Times,"""Mega"" version of Blazing World with tons of Nelson, Simcoe and Mosaic",San Diego,,,Double IPA
8.00%,,Mega Fortunate Islands,Modern Times,Dry hopped with Citra and Amarillo ,San Diego,,,Double IPA
12.00%,,Monster's Park with Coconut and Coffee,Modern Times,"Roasty, chocolaty goodness w/ the addition of house-roasted coffee & coconut",San Diego,,,Imperial Stout
7.00%,,Neverwhere,Modern Times,"A laser beam of pineapple, with a towering Citra, Centennial, Chinook aroma",San Diego,,,Brett IPA
5.80%,,Nitro Black House w/ Coconut and Cocoa,Modern Times,"Their classic black house stout with heaps of coconut and cocoa nibs.  Majestic, velvety decadence","San Diego, CA",,,American Stout
5.20%,,Oneida,Modern Times,Bright tropical fruit and lemongrass notes and the grapefruity citrus of Cascade ,San Diego,,,Pale Ale
7.50%,850352005570,Orderville,Modern Times,Fruit-forward character of Mosaic combined with the dank resinous of Simcoe ,San Diego,Modern Times Orderville 22oz,2061144,IPA
4.00%,,Passion Fruit and Guava Fruitlands,Modern Times,"The sour, salty base beer brings the funky refreshment, while the heavy dose of passion fruit and guava turns the whole thing into a fruity, tasty treat","San Diego, CA",,,Gose
4.00%,,Peach and Raspberry Fruitlands,Modern Times,"Sour, Salty base brings funky refreshment with a dose of peaches and raspberries for a fruity treat","San Diego, CA",,,Gose
7.00%,100000013991,Protocosmos,Modern Times,"Australian Galaxy hops elegantly high-five American Ahtanum & Centennial over a dry, delicate malt body, making this little gem an absolute pleasure during the summer heat.","San Diego, CA",Modern Times Protocosmos,608975,IPA
5.40%,852672002031,Schwarz,Modern Times,German-style Black Lager brewed with Ethiopian Chelelektu Coffee ,"San Diego, CA",Heater Allen Schwarz 22oz,2176343,Schwarzbier
7.30%,,Sleep Dealer,Modern Times,"Intensely hoppy IPA with Amarillo, Citra, Experimental Hop 06277 and Mosaic hops.",San Diego,,,IPA
5.70%,850352005402,Sleepless City,Modern Times,"A gorgeous brown ale, lovingly layered with house-roasted coffee, vanilla, and cocoa nibs.","San Diego, CA",Modern Times Sleepless City/Fortunate Islands Grapefruit Zest,1920033,Coffee Brown Ale
6.90%,,Southern Lands,Modern Times,"Featuring Centennial & Calypso hops. Juicy, citrusy, pineappley, & delicious",San Diego,,,IPA
4.80%,,Strawberry Fruitlands,Modern Times,"The sour, salty base beer brings funky refreshment and a heavy dose of strawberries",San Diego,,,Gose
13.00%,,"Tequila BA Monster's Park w/ Lime, Vanilla and Sea Salt",Modern Times,"Beautiful aromas of lime peel and subtle oak precede a palate-enrapturing fiesta of rich chocolate that lingers through a round, earthy finish. It's an unlikely combination of components that succeeds in a most epic fashion.","San Diego, CA",,,Barrel-Aged Imperial Stout
5.60%,850352005419,Trueland,Modern Times,"Loaded w/ Simcoe & Amarillo. Light body, big aroma, moderate bitterness",San Diego,Modern Times Universal Friend/Trueland 22oz,2590758,Pale Ale
7.20%,100000124604,Universal Friend,Modern Times,"Light, crisp, and refreshing. Nose is clove, grape, citrus, and a little sweetness",San Diego,Modern Times Funky Universal Friend 750ml,100000123966,Saison with grape must
13.70%,,Vanilla Bourbon Monster's Park,Modern Times,"Vanilla and bourbon add even more complexity to Monster's Park, with notes of chocolate, roast, dark fruit, coffee, and more that linger as you sip.",San Diego,,,Barrel-Aged Imperial Stout
6.20%,,Whizz Bang,Modern Times,Hopped with Riwaka and Experimental 07270 for huge aromas of grapefruit and tangerine followed by a glorious mouth-full of citrusy dankness,"San Diego, CA",,,IPA
7.00%,,Blam! Blam!,Modern Times / Garage Project,"Absurd amounts of uber-fresh Nelson, Denali, and Amarillo hops turn this beverage into a face-full of piney dankness over a bed of lush, tropical delights.","San Diego, CA",,,IPA
7.20%,59595959,Comet Rider,Modern Times + Bottlecraft,Collaboration between Modern Times and Bottlecraft! Tart and hoppy!,San Diego,Modern Times Comet Rider 6-pack + tote,1674651,American Wild Ale
5.20%,,Roots of Coincidence,Modern Times/Cloudwater,"The result of a collaboration with U.K. hop sorcerers Cloudwater. A wheat & pilsner malt bill alongside a delicious plethora of hops including Equinox, Southern Passion, Hallertau Blanc, Mosaic, and Simcoe result in an unstoppably juicy, tropical masterpiece with a luxuriously silky mouthfeel.","San Diego, CA",,,Pale Ale
5.20%,,Same Day XPA,Monkey Paw Brewing Company,"Juicy yet crisp with bright hop flavors and citrusy, orangey aromas",San Diego,,,Fresh Hop Pale Ale
5.80%,,Sweet Georgia Brown,Monkey Paw Brewing Company,"Dark, toasty and lightly sweet with notes of chocolate, coffee, biscuit and caramel",San Diego,,,Brown
9.40%,,Caffè della Vita,Monkish Brewing,"Tripel with pistachios, vanilla and Kochere coffee",Torrance,,,Tripel
9.40%,,Seme Della Vita,Monkish Brewing,Belgian-style tripel brewed with pistachios and vanilla beans,Torrance,,,Tripel
7.00%,850552005226,Shadowboxing,Monkish Brewing,"Dark amber Belgian-Style Dubbel, malty and fruity","Torrance, CA",Monkish Shadowboxing,1536192,Dubbel
6.40%,,St. Mosaic,Monkish Brewing,Mosaic single hop Belgian-style pale ,Torrance,,,Belgian Pale Ale
5.00%,,Tape Deck,Monkish Brewing,Light and refreshing with notes of anise and lemon,Torrance,,,Belgian-Style Witbier
7.00%,850552005080,Shaolin Fist,Monkish Brewing Company,Belgian-Style Dubbel w/ Sichuan Peppercorns ,Torrance,Monkish Shaolin Fist Bottle,478058,Dubbel
0.00%,,COFFEE: Cinna-Mostra Roll        ,Mostra Coffee,"Blend of cold brew, black tea and spices",Rancho Bernardo,,,Cold Brew Coffee
10.50%,858059004063,Big Mother,Mother Earth,"Brewed for their 3 Year Anniversary, this beer boasts huge aroma and flavor, staying balanced throughout.  Notes of Fruit Loops, Tropical fruit and creme brulee shines through with a slightly sweet finish","Vista, CA",Mother Earth Big Mother,481343,Triple IPA
6.50%,100000014110,Boo Koo,Mother Earth,Juicy mango and tropical notes with a spicy and dank finish,Vista,Mother Earth Boo Koo 6 pk,835465,IPA
5.20%,,Cali Creamin',Mother Earth,Smooth and refreshing with just the right amount of vanilla,Vista,,,Cream Ale with Vanilla
8.20%,858059004032,Hop Diggity,Mother Earth,"Intense tropical juiciness from the choice mix of citrus hops. Dry, drinkable, and dangerous","Vista, CA",Mother Earth Hop Diggity,481340,Double IPA
7.20%,858059004001,Kismet,Mother Earth,"Showcases the Nelson hop, tropical fruit notes with a solid malt backbone and assertive bitterness","Vista, CA",Mother Earth Kismet,481337,IPA
5.20%,,Cali Creamin',Mother Earth,Smooth and refreshing with just the right amount of vanilla,Vista,,,Cream Ale with Vanilla
8.10%,858059004070,Sin Tax,Mother Earth,Premium roasted malts and American Hops give way to a brown sugar and peanut butter essence that finishes beautifully,"Vista, CA",Mother Earth Sin Tax,481344,Imperial Stout
5.00%,100000014158,Honcho Hefe ,Mother Earth Brewing Co.,"Aromas and flavors of wheat, clove and slight Banana.",Vista,Mother Earth Honcho Hefe 6 pk,835467,Hefeweizen
8.50%,,Decipher Cipher,Mumford Brewing,"The abundance of Citra and Amarillo hops give off a bouquet of ripe melon, fresh raspberries, and sweet grapefruit.","Los Angeles, CA",,,Double IPA
4.80%,,Blue Paddle,New Belgium,"Pilsner with a refreshing crispness from noble hops and a rich, malty finish",Colorado,,,Czech Pilsener
9.00%,,Super IPA,New Belgium,Collaboration between New Belgium and Alpine,Colorado,,,DIPA
5.80%,094922851604,Explorer,New English Brewing,"Well balanced with a chewy maltiness, The flavor is a satisfying blend of caramel and biscuit malts, giving way to a pleasing bitterness, with a clean, dry, crisp finish.",San Diego,New English Explorer ESB 22oz,481042,ESB
9.30%,094922476524,Zumbar,New English Brewing,"Brewed with “El Mundo” a rich blend of Indonesian and Latin American coffee beans in the mash and also in the fermenter, as well as 2Lbs per Barrel of 72% cacao Belgian Chocolate","San Diego, CA",New English BA Zumbar,,Imperial Stout
6.50%,691054810549,Pure and Simple,New English Brewing ,Aromas and flavor of tropical fruit and citrus over some light caramel malt,San Diego,New English Pure and Simple 12oz,100000099766,IPA
11.00%,614036001063,Dragon's Milk,New Holland Brewing,roasty malt character intermingled with deep vanilla tones,Michigan,New Holland Dragon's Milk 12oz,2035238,BBA Imperial Stout
12.00%,,Dragon's Milk: Brewer's Select,New Holland Brewing,"A very limited batch of Dragon's Milk created using hand-picked barrels directly from distillers that retain more-than-usual bourbon character and carry that forward into the beer. A special treat for bourbon lovers and those looking for a little ""heat"" in their bee",Michigan,,,Barrel-Aged Stout
4.40%,,Baby Gaga,Noble Ale Works,"Light w/ hoppy flavors reminiscent of cactus cooler, fresh mint and cantaloupe",Anahiem,,,Session IPA
6.80%,852495006001,Big Whig,Noble Ale Works,"Layers of tangerine, honey and rosemary leading to a dry, resinous finish",Anaheim,Noble Big Whig IPA 22oz,476108,IPA
8.00%,100000015094,Citra Showers,Noble Ale Works,"Bursting with juicy layers of mango, lemongrass, and grapefruit",Anahiem,Noble Citra Showers,724563,Double IPA
7.50%,852495006018,I Love It,Noble Ale Works,"Mosaic, Simcoe, Citra, Centennial, Amarillo, Equinox and more",Pasadena,Noble I Love It IPA,836547,IPA
8.80%,,Idaho Showers,Noble Ale Works,"Single hopped with Idaho 7.  Aromas of California poppy, pine, and sage in a juicy double IPA","Anaheim,CA",,,Double IPA
6.50%,,Mass Confusion,Noble Ale Works,"Hazy from the wheat with aromas of pineapple, kiwi and banana","Anaheim,CA",,,Wheat IPA
8.80%,100000015131,Mosaic Showers,Noble Ale Works,Huge tropical hop aroma and taste,Anahiem,Noble Mosaic Showers,558480,Double IPA
4.40%,,Nose Candy,Noble Ale Works,Light and hoppy,Anahiem,,,Session IPA
4.40%,,Pilsnear,Noble Ale Works,"Light bodied, with flavors of freshly baked bread and magnolia flowers",Anahiem,,,Pilsner
4.50%,,Pistol Whip'd Pils,Noble Ale Works,Czech-Style Pils brewed with New Zealand’s Motueka hops,Anahiem,,,IPL
8.80%,100000015209,Sorachi Ace Showers,Noble Ale Works,Sorachi Ace is know for it's unique dill and lemon zest characteristics,Anahiem,Noble Sorachi Ace Showers,546604,DIPA
5.30%,,Tank Top,Noble Ale Works,"the lightest, qualitiest, Americanest beer possible","Anaheim,CA",,,Cream Ale
8.00%,852495006056,Tongue Tickles,Noble Ale Works,"Bursting with layers of stone fruit, bright citrus and pineapple",Anahiem,Noble Tongue Tickles 22oz,476131,Double IPA
8.80%,,Wakatu Showers,Noble Ale Works,"Wakatu offers flavors of blueberry, lime, and maraschino cherries",Anahiem,,,Double IPA
9.00%,866576000130,Imperial Stout,Nøgne Ø,"Deep aromas of dark chocolate, coffee, and roasted grain",Norway,BNS Gatling Gun Imperial Stout 22oz,100000102411,Imperial Stout
7.00%,,Kriek of Telemark,Nøgne Ø,Brewed with Norwegian sour cherries and a secret ingredient,Norway,,,Kriek
11.20%,,Barrel-Aged Old Rasputin XIX,North Coast Brewing Co,"A special batch of their much-loved Russian Imperial Stout in Bourbon barrels. Deep, intense, and complex flavor profile.","Fort Bragg, CA",,,Imperial Stout
3.45%,,Tart Cherry Berliner Weisse,North Coast Brewing Co.,Berlin-style tart wheat beer brewed with tart cherries,"Fort Bragg, CA",,,Berliner Weisse
6.60%,,Panoramic,North Park Beer Co,"A dank, resinous aroma and a flavor that is rounded out by its tropical fruit and citrus-lemon zest, honey-like quality","San Diego, CA",,,Pale Ale
8.60%,,Scolari's,North Park Beer Co,"6 different Hop varieties that give flavors of citrus, tropical fruit, and stone fruit.  Enough malt sweetness to balance the copious amounts of hops, making this Double IPA extremely drinkable.","San Diego, CA",,,Double IPA
9.00%,,Berserker Winter Imperial Stout,North Peak Brewing Company ,"Rich, thick & dark w/ an intense aroma of black currants, roasted coffee & hint of Cacao",Michigan,,,Imperial Stout
6.70%,,Vicious Wheat IPA,North Peak Brewing Company ,Wheat IPA with a generous amounts of hops,Michigan,,,Wheat IPA
3.80%,19962027345,Yuzu Fierce,Off Color,Berliner-style wheat beer brewed with Yuzu citrus fruit,"Chicago, IL",Off Color Yuzu Fierce,1396874,Berliner Weisse
4.50%,794504360264,Troublesome,Off Color Brewing ,Notes of lemon and some spiciness from the coriander. Finishes dry.,"Chicago, Illinois",Off Color Troublesome,2448619,Gose
6.00%,7350064990520,Abrahadabra,Omnipollo,"Brewed with Strawberries, vanilla, and lactose to simulate a smoothie",Sweden,Omnipollo Abrahadabra,1780823,Smoothie IPA
6.00%,73500649905440,Bianca Mango Lassi,Omnipollo,"Gose-style beer brewed with lactose, sea salt, and mango puree",Sweden,Omnipollo Bianca Mango Lassi Gose,1781017,Gose
6.00%,7350064990681,Bianca Raspberry,Omnipollo,"Sour ale brewed with lactose sugar, raspberries and rock salt",Sweden,Omnipollo Bianca Raspberry,100000097465,Gose
8.00%,,Fatamorgana Double IPA,Omnipollo,Double IPA brewed using oats and wheat,Sweden,,,DIPA
6.00%,,Magic #411 Smoothie IPA,Omnipollo,"IPA brewed with wild strawberry, rhubarb, vanilla and lactose",Sweden,,,IPA
4.50%,7350064990629,Nautilus,Omnipollo,"Brewed with blueberries, vanilla beans, and lactose sugar",Sweden,Omnipollo Nautilus,2137439,Sour Ale
10.00%,,Omniprairie,Omnipollo / Prairie,"Stout brewed w/ fresh salted caramel sauce, vanilla, cocoa nibs and lactose",Sweden,,,Imperial Milk Stout
12.90%,819942000319,Barrel-Aged Ten Fidy,Oskar Blues,"This titanic, immensely viscous stout is loaded with inimitable flavors of chocolate-covered caramel and coffee and is aged in Bourbon Barrels",Colorado,Oskar Blues Barrel-Aged Ten Fidy CAN,,Imperial Stout
7.00%,819942000494,Bayside Black IPA,Oskar Blues,"A malty backbone with bright, citrusy hops, this beer was brewed with the band Bayside in Celebration of their new album Vacancy",Colorado,Oskar Blues Bayside Black IPA CAN,,Black IPA
4.00%,819942000401,Beerito,Oskar Blues,"Incredibly smooth with flavors of walnut, toasted bread, plum, honey, and cocoa",Colorado,Oskar Blues Beerito,2206223,Mexican Lager
6.50%,819942000227,Death by Coconut,Oskar Blues,Irish-style porter brewed with coconut and chocolate,Colorado,Oskar Blues Death By Coconut Can,1584343,Porter
7.00%,,IceyPA,Oskar Blues,"Zesty citrus hops, pineapple, peaches, and a hint of toasted wheat",Colorado,,,White IPA
5.50%,,Shordy Stout,Oskar Blues,"A hoppy, bitter, strongly roasted Foreign-style Stout (of the export variety)",Colorado,,,Foreign Stout
5.50%,,Sour Sherry Mama's Little Yella Pils,Oskar Blues,Sour Sherry Barrel Aged Mama's Little Yella Pils,Colorado,,,American Wild Ale
10.50%,819942000319,Ten FIDY,Oskar Blues,Viscous stout loaded with flavors of chocolate-covered caramel and coffee,Colorado,Oskar Blues Barrel-Aged Ten Fidy CAN,,Imperial Stout
6.50%,819942000364,Hotbox Coffee Porter,Oskar Blues Brewing Company,"Rich, Robust with obscene amount balinese coffee",Colorado ,Oskar Blues Hotbox Coffee Porter,1683094,Porter
5.00%,74825255650,Continental,Oxbow Brewing Company,American style pale ale made with all European hops,Maine,Butchers Continental Stout,693146,Pale Ale
6.00%,,Farmhouse Pale,Oxbow Brewing Company,"American hops meet saison yeast in this dry, signature ale",Maine,,,Saison
6.90%,100000005170,Dual Artisanship,Perennial + Prairie Artisan Ales,Red saison fermented with a blend of ale yeast and Brett and dry-hopped with Centennial and Simcoe,"St. Louis, Missouri ",Perennial Ales Dual Artisanship,722680,Saison
9.30%,857198003357,17 Mint Chocolate Stout,Perennial Artisan Ales,Decadent chocolate stout complimented with a smooth mint finish ,"St. Louis, Missouri ",Perennial Ales 17 Mint Chocolate Stout,722678,Imperial Stout
10.00%,857198003128,Abraxas,Perennial Artisan Ales,"Brewed with ancho chili peppers, cacao nibs, vanilla beans, and cinnamon sticks. Pouring deep brown with a thick head, this beer has a complex body with a delicious lingering roastiness",Missouri,Perennial Ales Abraxas,558499,Imperial Stout
7.30%,100000000540,Aria,Perennial Artisan Ales,Belgian Ale brewed with Brettanomyces,"St. Louis, Missouri ",2 Towns Rhubarbarian 4pk,836025,Belgian Pale Ale
5.90%,,Hommel Bier,Perennial Artisan Ales,Earthy and spicy tones from the yeast with citrus notes from the hops,"St. Louis, Missouri ",,,Dry Hopped Belgian Pale
4.20%,100000005293,Hopfentea,Perennial Artisan Ales,Brewed with a homemade tea blend imparting apricot hue & botanical aromatics,"St. Louis, Missouri ",Perennial Hopfentea Btl,892552,Berlinerweiss
4.20%,100000005644,Peach Berliner Weisse,Perennial Artisan Ales,"Delicate peach and sour aromas, ending perfectly with a crisp dry finish","St. Louis, Missouri ",Perennial Peach Berliner Weisse Bottle,1467240,Berliner Weisse
8.50%,10857198003101,Regalia,Perennial Artisan Ales,Fermented with Brettanomyces Bruxellensis and Brettanomyces Anomala,"St. Louis, Missouri ",Perennial Regalia 750ml,994649,Rustic Farmhouse Ale
5.00%,857198003067,Saison de Lis,Perennial Artisan Ales,Saison brewed with chamomile flowers,"St. Louis, Missouri ",Perennial Saison de Lis bottle,558500,Saison
5.00%,,Southside Blonde,Perennial Artisan Ales,"Refreshing golden ale brewed with a Belgian yeast strain
","St. Louis, Missouri ",,,Belgian Style Blonde Ale
4.20%,857198003272,Suburban Beverage,Perennial Artisan Ales,"Gose-style ale brewed with salt, orange peel, lemon peel and key lime juice","St. Louis, Missouri ",Perennial Suburban Beverage Bottle,1321464,Gose
10.50%,857198003456,Sump ,Perennial Artisan Ales,Imperial Stout blended with Sump Coffee,"St. Louis, Missouri ",Perennial SUMP 750ml,835644,Imperial Stout
3.90%,,Blood Orange Broadacres,Phantom Carriage,Sour wheat beer brewed with Blood Oranges,"Carson, CA",,,Berliner Weisse
3.90%,100000102329,Broadacres,Phantom Carriage,Brettanomyces and lactobacillus fermented wild berliner weisse,"Carson, CA",Phantom Carriage BA Apricot Broadacres 500ml,100000101162,Berliner Weisse
3.90%,,Broadacres With Peaches,Phantom Carriage,Sour wheat beer brewed with peaches,"Carson, CA",,,Berliner Weisse
3.90%,,Grapefruit Broadacres w/ Simcoe,Phantom Carriage,Sour wheat beer brewed with Grapefruit and dry-hopped with Simcoe,"Carson, CA",,,Berliner Weisse
3.90%,,Mango Broadacres,Phantom Carriage,Sour wheat beer brewed with Mango,"Carson, CA",,,Berliner Weisse
3.90%,,Mixed Berry Broadacres,Phantom Carriage,Sour wheat beer brewed with a berry medley,"Carson, CA",,,Berliner Weisse
6.50%,100000007792,Muis,Phantom Carriage,Tropical and citrus fruits dominate the palate w/ hints of herbal hops and a dry finished,"Carson, CA",Phantom Carriage Citra Muis 750ml,2175790,Wild Belgian Blonde
3.90%,,Passion Fruit Broadacres,Phantom Carriage,Sour wheat beer brewed with Passion Fruit,"Carson, CA",,,Berliner Weisse
3.90%,,Raspberry Broadacres,Phantom Carriage,Sour wheat beer brewed with Raspberries,"Carson, CA",,,Berliner Weisse
6.50%,,Simcoe Muis,Phantom Carriage,Muis dry hopped with Simcoe hops,"Carson, CA",,,Wild Belgian Blonde
3.90%,100000102312,Strawberry Broadacres,Phantom Carriage,Sour wheat beer brewed with strawberries,"Carson, CA",Phantom Carriage BA Strawberry Broadacres 500ml,,Berliner Weisse
3.90%,,Tart Cherry Broadacres,Phantom Carriage,Sour wheat beer brewed with cherries,"Carson, CA",,,Berliner Weisse
10.00%,,Hop-15,Port Brewing,Huge fresh hop resins with pine and citric aromas countered with notes of malt,San Marcos,,,Imperial IPA
12.00%,,Older Viscosity ,Port Brewing,Imperial Stout aged for 12 months in new bourbon barrels,San Marcos,,,BBA Imperial Stout
10.00%,,Santa's Little Helper,Port Brewing,Dark cocoa and roasted coffee aromatics,San Marcos,,,Imperial Stout
9.00%,689926000136,Shark Attack,Port Brewing,Smooth and malty with a generous hop character,San Marcos,Port Shark Attack,481142,Imperial Red
6.00%,,Summer Pale Ale,Port Brewing,"Initial nose of dankness with subtle pine, and tangerine-like bitterness",San Marcos,,,Pale Ale
